{
  "schemaVersion": "1.0",
  "id": "kalman-filters",
  "title": "The Kalman Filter Family",
  "subtitle": "From linear-Gaussian estimation to multiple-model tracking",
  "subject": "Estimation & Control",
  "level": "undergrad-to-frontier",
  "description": "Zero-to-hero on recursive state estimation: why the Kalman filter is the optimal linear-Gaussian estimator, the two different ways (EKF, UKF) to keep using it when the world goes nonlinear, and how IMM handles a system that switches behaviors. After this you can re-derive each from first principles and tell the story of why each exists.",
  "provenance": {
    "kind": "researched",
    "generatedBy": "gigabrain-author",
    "created": "2026-06-22",
    "sources": [
      { "title": "Kalman, R.E. (1960) — A New Approach to Linear Filtering and Prediction Problems", "note": "the original linear KF" },
      { "title": "Welch & Bishop — An Introduction to the Kalman Filter", "url": "https://www.cs.unc.edu/~welch/kalman/", "note": "canonical tutorial" },
      { "title": "Julier & Uhlmann (1997) — A New Extension of the Kalman Filter to Nonlinear Systems", "note": "the unscented transform / UKF" },
      { "title": "Blom & Bar-Shalom (1988) — The Interacting Multiple Model algorithm for systems with Markovian switching coefficients", "note": "IMM" }
    ]
  },
  "srsDefaults": { "algorithm": "sm2", "initialEase": 2.5, "firstIntervalDays": 1 },
  "nodes": [
    {
      "id": "state-space-and-bayes",
      "title": "State-space models and the predict-update heartbeat",
      "summary": "A hidden state you can't see, noisy measurements you can, and a recursive belief you update each step.",
      "prereqs": [],
      "diagramMermaid": "flowchart LR; Pr[Predict: push belief forward] --> Up[Update: correct with measurement]; Up --> Pr; Z((measurement z)) --> Up",
      "intake": "Before any Kalman filter, two ideas. First, a state-space model: a system has a hidden state vector x — say position and velocity — that evolves over time, x_k = f(x_{k-1}) + noise, and measurements z that are a noisy function of the state, z_k = h(x_k) + noise. You never see x directly; you only ever see z, and you must infer x. Second, recursive Bayesian estimation: instead of one best guess, carry a belief about x as a probability distribution, and revise it whenever a measurement arrives. The rhythm is always the same two beats: take your prior, PREDICT it forward through the dynamics (which makes you less certain), then UPDATE by folding in the new measurement (which makes you more certain) to get a posterior — and that posterior is the prior for the next step. Every filter in this course is this predict-update heartbeat; they differ only in how they represent and push around the belief. The plain Kalman filter is what you get when the belief is Gaussian and the model is linear.",
      "items": [
        { "id": "ss-1", "type": "cloze", "rung": 1,
          "text": "In a state-space model you never observe the hidden {{c1::state}} directly — you only see noisy {{c2::measurements}} and must infer the {{c1::state}} from them.",
          "answers": { "c1": "state", "c2": "measurements" } },
        { "id": "ss-2", "type": "cloze", "rung": 1,
          "text": "Every filter shares a two-beat rhythm: {{c1::predict}} pushes the belief forward (less certain), then {{c2::update}} folds in the measurement (more certain).",
          "answers": { "c1": "predict", "c2": "update" } },
        { "id": "ss-3", "type": "qa", "rung": 3,
          "prompt": "Why carry the estimate as a probability distribution instead of a single best-guess value?",
          "answer": "Because the spread (covariance) encodes how much to trust the estimate, and that uncertainty is exactly what lets the update optimally weigh a new measurement against the prior — a point estimate throws that information away.",
          "acceptable": ["uncertainty", "covariance", "trust", "weigh"],
          "rubric": "Must connect carrying a distribution to tracking uncertainty and using it to weight the update." },
        { "id": "ss-4", "type": "qa", "rung": 2,
          "prompt": "What does the predict step do to your uncertainty, and what does the update step do to it?",
          "answer": "Predict increases uncertainty (the dynamics + process noise spread the belief out); update decreases it (the measurement sharpens the belief).",
          "acceptable": ["predict", "increase", "update", "decrease"],
          "rubric": "Predict grows uncertainty; update shrinks it." }
      ]
    },
    {
      "id": "kf-core",
      "title": "The linear Kalman filter",
      "summary": "When the model is linear and noise Gaussian, the belief stays Gaussian — track just a mean and a covariance, and the update is provably optimal.",
      "prereqs": ["state-space-and-bayes"],
      "diagramMermaid": "flowchart LR; subgraph Predict; A[x-hat, P] --> B[push through F, add Q]; end; subgraph Update; B --> K[Kalman gain K]; Z((z)) --> K; K --> C[blend toward z]; end",
      "intake": "The Kalman filter is the recursive Bayesian filter for one special, beautiful case: the model is LINEAR and all noise is GAUSSIAN. Under those two assumptions the belief stays Gaussian forever, so the entire belief is just a mean (your estimate, x-hat) and a covariance (your uncertainty, P) — no histograms, no particles. Predict: push the mean through the linear dynamics F and grow P by the process noise Q. Update: when measurement z arrives, form the innovation (the surprise) = z minus your predicted measurement, then compute the Kalman gain K — the optimal blend between trusting your prediction and trusting the measurement, set entirely by their relative uncertainties — and nudge the estimate toward z by K times the innovation. In the linear-Gaussian world this is OPTIMAL: no estimator achieves lower mean-squared error. That optimality is why everyone reaches for it — and why the rest of this course is a sequence of clever tricks for keeping this machinery when reality breaks the 'linear' or the 'Gaussian'.",
      "items": [
        { "id": "kf-1", "type": "cloze", "rung": 1,
          "text": "Under linear-Gaussian assumptions the belief stays {{c1::Gaussian}}, so the KF only needs to track a {{c2::mean}} and a {{c3::covariance}}.",
          "answers": { "c1": "Gaussian", "c2": "mean", "c3": "covariance" } },
        { "id": "kf-2", "type": "cloze", "rung": 2,
          "text": "The {{c1::Kalman gain}} decides how much to trust the new measurement versus the prediction, based on their relative {{c2::uncertainty}}.",
          "answers": { "c1": "Kalman gain", "c2": "uncertainty" } },
        { "id": "kf-3", "type": "qa", "rung": 2,
          "prompt": "Under exactly which two conditions is the Kalman filter optimal (minimum mean-squared error)?",
          "answer": "Linear dynamics and measurement models, and Gaussian noise.",
          "acceptable": ["linear", "gaussian"],
          "rubric": "Both: linearity of the model AND Gaussian noise." },
        { "id": "kf-4", "type": "qa", "rung": 3,
          "prompt": "Explain what the Kalman gain does and why it depends on the uncertainties.",
          "answer": "It is the weight applied to the innovation (measurement surprise). When the prediction is uncertain (large P) relative to the measurement noise (R), the gain is high — lean on the measurement; when the measurement is noisy relative to a confident prediction, the gain is low — lean on the model. It is the optimal uncertainty-weighted blend of the two.",
          "acceptable": ["innovation", "high", "low", "uncertainty", "blend"],
          "rubric": "Gain = uncertainty-weighted blend; high when prediction uncertain / measurement trustworthy, low otherwise." },
        { "id": "kf-5", "type": "discrimination", "rung": 2,
          "prompt": "Exactly one is FALSE:",
          "choices": [
            "The KF must store the full posterior as a histogram of probabilities",
            "Predict increases uncertainty; update decreases it",
            "The KF is optimal only under linear-Gaussian assumptions",
            "The innovation is the difference between the measurement and its prediction"
          ],
          "correctIndex": 0,
          "explanation": "A Gaussian belief is fully captured by a mean + covariance — no histogram or particle set is needed." }
      ]
    },
    {
      "id": "ekf",
      "title": "Extended Kalman Filter — linearize the nonlinearity",
      "summary": "Keep the exact KF machinery, but replace the nonlinear functions with their first-order Taylor (Jacobian) approximation at the current estimate.",
      "prereqs": ["kf-core"],
      "intake": "Reality is rarely linear: a radar measures range and bearing (nonlinear in x,y); a robot turns (nonlinear dynamics). The Extended Kalman Filter keeps the exact Kalman machinery but LINEARIZES the nonlinear functions at each step — it takes the first-order Taylor expansion of f and h around the current estimate, using their Jacobians (matrices of partial derivatives) wherever the plain KF used the constant matrices F and H. It is cheap and works astonishingly often — a version of it flew the Apollo guidance computer. But the linearization is only valid NEAR the estimate: when the nonlinearity is strong or the uncertainty is wide, the first-order approximation biases the estimate, the reported covariance stops reflecting reality, and the filter can DIVERGE. It also presumes you can get derivatives — you need differentiable models and the algebra (or autodiff) to compute Jacobians.",
      "items": [
        { "id": "ekf-1", "type": "cloze", "rung": 1,
          "text": "The EKF copes with nonlinearity by {{c1::linearizing}} the model each step using its {{c2::Jacobians}} (a first-order {{c3::Taylor}} expansion).",
          "answers": { "c1": "linearizing", "c2": "Jacobians", "c3": "Taylor" } },
        { "id": "ekf-2", "type": "qa", "rung": 2,